"DESCRIPTION","DURATION IN MS","NAME","PARENT SUITE","START TIME","STATUS","STOP TIME","SUB SUITE","SUITE","TEST CLASS","TEST METHOD"
"Verify that submitting the login form with both fields empty triggers the server-side validation error ""Invalid user or password"".","1898","C002 - Login with empty fields","chromium","2026-06-12","passed","2026-06-12","Login","","",""
"Verify that submitting wrong username and password shows an error message ""Invalid user or password"" and does not authenticate the user.","2817","C001 - Login with invalid credentials","chromium","2026-06-12","passed","2026-06-12","Login","","",""
"Verify that the Download wiki page displays the ""Latest releases"" section, provides at least one .tar.gz and one .zip download link, and includes the version support status table.","1785","C005 - Download page shows latest release versions","chromium","2026-06-12","passed","2026-06-12","","","",""
"Verify that the Redmine homepage loads correctly and all expected top-navigation links are visible. Then verify the Projects link navigates to /projects.","2150","C003 - Homepage navigation structure","chromium","2026-06-12","passed","2026-06-12","","","",""
"Verify that searching for ""plugin"" from the Redmine homepage navigates to the search results page and displays at least one result.","2126","C004 - Search for a keyword returns results","chromium","2026-06-12","passed","2026-06-12","","","",""
