"DESCRIPTION","DURATION IN MS","NAME","PARENT SUITE","START TIME","STATUS","STOP TIME","SUB SUITE","SUITE","TEST CLASS","TEST METHOD"
"Verify that wrong credentials show ""Invalid user or password"" error.","3691","C001 - Verify that login with invalid credentials shows an error","chromium","2026-06-25","passed","2026-06-25","Login","","",""
"Verify searching ""plugin"" navigates to search results page with at least one result.","2865","C004 - Verify that searching for a keyword returns results","chromium","2026-06-25","passed","2026-06-25","","","",""
"Verify homepage loads and all top-nav links are visible. Projects link navigates to /projects.","3851","C003 - Verify that homepage navigation links are visible and functional","chromium","2026-06-25","passed","2026-06-25","","","",""
"Verify that submitting empty form triggers ""Invalid user or password"" error.","2890","C002 - Verify that submitting empty fields shows an error","chromium","2026-06-25","passed","2026-06-25","Login","","",""
"Verify Download page has Latest releases section, .tar.gz/.zip links, and support table.","2497","C005 - Verify that Download page shows latest release versions","chromium","2026-06-25","passed","2026-06-25","","","",""
